#CODE;ENGLISH;FRENCH;GERMAN;;SPANISH;;;;;;;;;x
NOT_IN_DYNASTY;NEM az alábbi család tagja:;N'est PAS un membre de la Maison;Ist KEIN Mitglied von Haus ;;NO forma parte de la Casa ;;;;;;;;;x
IN_DYNASTY;Az alábbi család tagja:;Est un membre de la Maison ;Ist ein Mitglied von Haus ;;Forma parte de la Casa ;;;;;;;;;x
REALM_MANPOWER_LESS;Maximális birodalmi katonaság kevesebb, mint §Y$VAL$§W;Nombre maximum de conscrits dans le royaume plus petit que §Y$VAL$§W;Gesamttruppen im Reich weniger als §Y$VAL$§W;;Las levas máximas del reino son menos de §Y$VAL$§W;;;;;;;;;x
REALM_MANPOWER_LEAST;Maximális birodalmi katonaság legalább §Y$VAL$§W;Nombre maximum de conscrits dans le royaume plus grand que §Y$VAL$§W;Gesamttruppen im Reich mindestens §Y$VAL$§W;;Las levas máximas del reino son al menos de §Y$VAL$§W;;;;;;;;;x
REALM_SIZE_LESS;Birodalom méret kisebb, mint §Y$VAL$§W;Taille du royaume plus petite que §Y$VAL$§W;Reichsgröße weniger als §Y$VAL$§W;;El tamaño del reino es de menos de §Y$VAL$§W;;;;;;;;;x
REALM_SIZE_LEAST;Birodalom méret legalább §Y$VAL$§W;Taille du royaume plus grande que §Y$VAL$§W;Reichsgröße mindestens §Y$VAL$§W;;El tamaño del reino es al menos de §Y$VAL$§W;;;;;;;;;x
tut_6a_6;Søroyar, nyugatra Ross területétõl jó célpontnak tûnik. Jól kiegészítené határunkat, mellesleg a katonáinak száma sem túl lenyûgözõ. Kattints a területre.;Søroyar à l'ouest de Ross semble être une bonne cible. Ce serait un ajout intéressant à nos frontières, de plus son nombre maximum de troupes n'est pas très impressionant. Cliquez sur sa province.;Soreyar, westlich von Ross, scheint ein gutes Ziel zu sein. Es wäre eine nette Bereicherung für Euch und die Größe der Armee ist nicht sehr beeindruckend. Klickt die Provinz.;;Søroyar al oeste de Ross parece un buen objetivo. Sería una bonita incorporación a nuestras fronteras, además su número máximo de levas no da ningún miedo. Pincha en la provincia.;;;;;;;;;x
tut_6a_10;Most küldjük a Kancellárt egy titkos küldetésre, hogy követelést állítsunk. Kattints a 'Követelés állítása' gombra, majd kattints Søroyar területére, hogy odaállítsd a kancellárt.;Maintenant envoyons notre chancelier en mission secrète afin de fabriquer une revendication. Cliquez sur le bouton 'Fabriquer des revendications' ensuite cliquez sur Søroyar pour y placer le chancelier.;"Nun lasst uns Euren Kanzler auf eine geheime Mission schicken. Klickt zuerst die Schaltfläche ""Ansprüche fingieren"" und dann auf Soreyar, um Euren Kanzler zu entsenden.";;Ahora vamos a enviar a nuestro canciller con la secreta misión de crear reclamaciones. Pincha en el botón de crear reclamaciones, después selecciona Søroyar para enviar allí a tu canciller.;;;;;;;;;x
tut_8b_8;Ami egy Keresztes hadjáratot ösztönöz, az az, hogy a Pápa kijelöl egy területet, amit a Katolikus egyház nevében meg kell hódítani. Hogy ez lehetséges legyen a számára, a területet muszlimoknak vagy pogányoknak kell birtokolni. Amikor ez megtörténik, egy különleges Keresztes hadjárat kezdõdik, amihez a Pápával történõ diplomáciai képernyõn tudsz csatlakozni, hogy felajénlod a 'Csatlakozás egy háborúhoz' opciót.;Une Croisade est déclenchée lorsque le Pape désigne une région qui doit être conquise au nom de l'église Catholique. Afin de pouvoir faire celà, il faut que la région soit actuellement sous le contrôle de Musulmans ou de Paiens. Lorsqu'il lance cet acte, une guerre de Croisade spéciale commencera et vous pourrez rejoindre celle-ci en allant dans les actions diplomatiques du Pape et en choisissant 'Proposer de rejoindre la guerre'.;Um einen Kreuzzug zu beginnen muss der Papst eine Region auswählen, die im Namen der katholischen Kirche erobert werden soll. Diese Region muss sich derzeit in der Hand von Moslems oder Heiden befinden. Sobald der Papst einen Kreuzzug ausruft beginnt der eigentliche Krieg, dem Ihr Euch über das Diplomatiemenü des Papstes anschließen könnt.;;Lo que inicia una Cruzada es que el Papa decide que una zona tiene que ser conquistada en nombre de la Iglesia Católica. Para que pueda hacerlo esta debe estar controlada por musulmanes o paganos. Cuando lo hace, una guerra de Cruzasa empezará y podrás participar yendo a la pantalla de diplomacia del Papa y eligiendo 'Ofrecerse a entrar en guerra'.;;;;;;;;;x
tut_8b_9;Ha egy hadjárat sikeres, az uralkodó, aki a legnagyobb hatással volt a hadjárat kimenetelére (legmagasabb részvételi pontszám) a katolikus oldalról õt fogják tartani a hadjáratot megnyerõ embernek.;Si une Croisade est une succès, le dirigeant qui a eu le plus grand impact (le score de participation le plus haut) du côté Catholique de la guerre sera considéré comme étant le vainqueur de la Croisade.;Sollte ein Kreuzzug erfolgreich sein, so wird der katholische Herrscher, der den größten Beitrag leistete zum Sieger erklärt.;;Si la Cruzada es exitosa, el gobernante que haya tenido el mayor impacto (mayor puntuación de participación) en el bando católico será considerado como el vencedor de la Cruzada.;;;;;;;;;x
tut_8b_10;Csatlakoznod kéne a Keresztes hadjárathoz és neked kéne megnyerni a háborút, így te kapnád meg az ellenség által birtokolt területeket a hadjárat területén. Kapsz még áhitatot és tekintélyt és egy egyedi 'Keresztes' tulajdonságot.;Dans le cas où vous choisissez de rejoindre la Croisade et réussissez à devenir celui qui gagne la Croisade, vous recevrez toutes les terres tenues par l'ennemi dans la région de la Croisade.Vous recevrez aussi de la piété et du prestige, ainsi que le trait 'Croisé'.;"Solltet Ihr Euch einem Kreuzzug anschließen und diesen sogar zu gewinnen, so wird Euch alles Land zugesprochen, dass der Feind in der umkämpften Region besaß. Zusätzlich erhaltet ihr Prestige, Pietät und die Eigenschaft ""Kreuzfahrer"".";;Si decides participar en la Cruzada y consigues ser el vencedor, recibirás todas las tierras gobernadas por el enemigo en la zona de la Cruzada. También ganarás piedad y presigio, así como el rasgo de Cruzado.;;;;;;;;;x
tut_8b_11;Csatlakoznod kéne a Keresztes hadjárathoz, de ha egy másik katolikus uralkodó nyeri meg, nem fogsz földekhez jutni, de kapni fogsz áhitatot és tekintélyt, és a 'Keresztes' tulajdonságot. Kattints a Tovább gombra befejezéshez.;Dans le cas où vous rejoignez la Croisade mais c'est un autre catholique qui la gagne, vous ne recevrez aucune terre mais vous recevrez quand même de la piété et du prestige ainsi que le trait 'Croisé'. Cliquez sur suivant pour terminer ce chapitre.;"Solltet Ihr Euch einem Kreuzzug anschließen, der von einem anderen katholischen Herrscher gewonnen wird, so erhaltet Ihr keinerlei Land, jedoch ebenfalls Prestige, Pietät und die Eigenschaft ""Kreuzfahrer"". Klickt auf ""weiter"", um diesen Teil des Tutorials zu beenden.";;Si decides participar en la Cruzada pero otro de los participantes es el vencedor, no recibirás ni un acre de tierra, pero recibirás piedad y presigio, así como el rasgo Cruzado. Pulsa siguiente para terminar este capitulo.;;;;;;;;;x
tut_8b_4;Katolikus uralkodód egyházi hûbéresei csak akkor juttatnak számodra katonákat és adót, ha jobb véleményük van rólad, mint a Pápáról. A legegyszerûbb, hogy ezt megvalósítsd, hogy kijelölsz valakit püspöknek, aki már kedvel téged. Kattints a 'Törvények' gombra, hogy lásd, hogyan valósíthatod ezt meg.;Les vassaux religieux d'un dirigeant catholique ne vous donnerons troupes et argent que s'ils ont une meilleure opinion de vous que du Pape. Le meilleur moyen de s'en assurer est en fait de nommer évêque quelqu'un qui vous aime déjà. Cliquez sur l'onglet Lois afin de découvrir commment accomplir cela.;"Religiöse Vasallen eines katholischen Herrschers entrichten diesem nur dann Steuern und Truppen, wenn sie von ihm eine höhere Meinung haben als vom Papst. Die einfachste Methode, um dies sicherzustellen ist es, nur solche Leute zum Bischof zu ernennen, die Euch bereits wohlgesonnen sind. Klickt die Schaltfläche ""Gesetze"", um zu erfahren, wie Ihr dies bewerkstelligen könnt.";;Los vasallos eclesiásticos de un gobernante católico sólo te ayudarán tropas y dinero si tienen mejor opinión sobre ti que sobre el Papa. La mejor forma de asegurarse de ello, es apuntar a alguien que te sea leal como obispo. Mira las leyes para comprobar como hacerlo.;;;;;;;;;x
tut_7c_5;Egyszerre egy cselszövésed és egy egy ambíciód lehet beállítva. Ha már van cselszövésed folyamatban, és más ellen szeretnél szervezkedni, elõbb vissza kell mondani az elõzõt.;Vous pouvez avoir un complet et une ambition active à n'importe quel moment. Si vous avez déjà un complot et désirez manigancer contre un autre personnage, vous devez auparavant annuler votre ancien complot.;Ihr könnt nur eine Verschwörung und eine Ambition gleichzeitig besitzen. Wollt ihr gegen einen weiteren Charakter intrigieren, so müsst ihr eure alte Verschwörung zunächst abbrechen.;;Sólo puedes tener activos un complot y una ambición al mismo tiempo. Si ya participas en un complot y quieres conspirar contra otro personaje, primero deberás cancelar tu viejo complot.;;;;;;;;;x
tut_7b_4;A portrédtól balra látsz egy kis kerek, 'Ambíció választása' nevû gombot. Itt tudsz a jelenlegi karaktered számára egy ambíciót kitûzni. Ilyen ambíciók lehetnek például: megházasodni, egy nagy rakás aranyat fehalmozni, hatalmas tekintélyre szert tenni és más ehhez hasonló dolgok. Ha sikeresen teljesítesz egy ambíciót jutalomban részesülsz, természetesen nagyobb jutalom jár a nehezebb ambíciókért.;A gauche de votre portrait vous trouverez un petit bouton circulaire appelé 'Choisir une ambition'. C'est là que vous pouvez déterminer l'ambition de votre personnage actuel. Les ambitions types sont de se marrier, d'amasser une grande somme d'argent, d'avoir un millier de prestige ou d'autres choses de ce type. Lorsque vous réussissez à accomplir votre ambition, vous recevrez aussi une sorte de récompense. Celle-ci sera plus important plus l'ambition est difficile à atteindre bien sûr.;"Links neben Eurem Porträt könnt Ihr eine runde Schaltfläche mit dem Namen ""Wählt eine Ambition"" finden. Hier könnt Ihr die Ambition wählen, der euer Charakter folgen soll. Beispiele für mögliche Ambitionen sind Heirat, die Anhäufung von Reichtümern, die Ansammlung von 1000 Punkten Prestige oder ähnliche Dinge. Wenn Ihr Eure Ambition erfolgreich abschließt, erhaltet ihr eine Belohnung. Schwierigere Ambitionen erzielen verständlicherweise höhere Belohnungen.";;"A la izquierda de tu retrato podrás ver un pequeño botón circular llamado ""Escoger Ambición'. Aquí es donde puedes escoger una ambición para tu personaje actual. Posibles ambiciones son casarse, ahorrar una gran cantidad de dinero, ser muy prestigioso, o cosas semejantes. Cuando consigues llevar a cabo una ambición, recibirás una recompensa, que será mejor según la dificultad de conseguir lo ambicionado.";;;;;;;;;x
tut_7c_4;"Már beszéltünk az ambíciókról a cselszövés gyakorlat során is. Cselszövéseket a karakter képernyõrõl is létrehozhatsz, ha megnyomod a célpont karakter képernyõjén a 'Cselszövés kiválasztása' gombot. Ám, mivel nehéz elõre megmondani kinek fog kedvezni egy cselszövésed, ezért egy egyszerûbb megoldás, ha a Cselszövés menü megfelelõ funkcióját hazsnálod. Ami egy nagy gomb ""Kattints a cselszövés kiválasztásához"" felirattal.";Nous avons parlé des ambitions dans le tutoriel intermédiaire sur les intrigues. Les complots peuvent aussi être choisis à partir de l'écran du portrait de votre personnage en trouvant un autre personnage contre lequel vous désirez comploter et en cliquant le bouton 'Choisir un complot'. Cependant, parce qu'il est difficile de savoir les bénefices que pourraient vous rapporter un complot contre un personnage donné, un moyen plus facile est d'utiliser le menu des complots dans l'écran intrigue afin de trouver des complots intéressants. C'est un grand bouton appellé 'Cliquez pour choisir un complot'.;"Über Ambitionen haben wir im mittleren Intrigen-Tutorial geredet. Verschwörungen können ebenfalls über den Charakterbildschirm ausgewählt werden. Geht hierzu auf den Charakterbildschirm der Zielperson und klickt die Schaltfläche ""Wählt einen Anschlag"". Da es allerdings mitunter schwer sein kann zu erkennen, von welchen möglichen Verschwörungen Ihr am meisten profitieren würdet, gibt es einen einfacheren Weg um interessante Verschwörungen zu finden. Geht hierfür auf die Intrigenseite und klickt auf die große Schaltfläche, die mit ""Zur Auswahl einer Verschwörung klicken"" betitelt ist. ";;Ya hemos hablado sobre ambiciones el tutorial intermedio sobre la intriga. Los complots también pueden ser esogidos desde la pantalla del retrato del personaje buscando un personaje contra el que quieras conspirar y seleccionando el botón 'Escoger Complot'. Sin embargo, ya que es dificil saber exáctamente contra quien te beneficiaria conspirar, es más facil hacerlo desde la selección de conspiraciones. Es un botón alargado llamado 'Seleccionar Complot';;;;;;;;;x
tut_7b_2;Ebben a részben megismerkedsz az ambíciókkal. Minden játszható karakter választhat egy ambíciót kiegészítve az ördögi cselszövéseiket. Kattints a karakteredre a további tudnivalókért.;Ce chapitre vous parlera des ambitions. Tous les personnages jouables peuvent sélectionner une ambition en plus de manigancer des complots sournois. Cliquez sur le portrait de votre personnage pour en apprendre plus.;Dieser Teil wird Euch über Ambitionen aufklären. Alle Charaktere können neben ihren hinterhältigen Verschwörungen auch persönliche Ambitionen wählen. Klickt auf das Porträt eures Charakters, um mehr darüber zu erfahren.;;Este apartado tratará sobre las ambiciones. Todos los personajes jugables pueden seleccionar una ambición además de participar en conspiraciones. Selecciona el retrato de tu personaje para aprender más.;;;;;;;;;x
tut_5b_4;A hadsereg menüben kétféle kiállítható katonaságot láthatsz: személyes és hûbéresi katonaságot. A személyes seregeid te magad irányítod, míg a hûbéreseid embereit õ maguk, vagy az õ hûbéreseik irányítják. Kattints a tovább gombra a folytatáshoz.;Dans l'onglet militaire 'Ost', vous pouvez voir qu'il y a deux sortes de troupes: l'ost et le ban. L'ost sont les conscrits de votre domaine que vous contrôlez vous même tandis que le ban sont les troupes contrôlées par vos vassaux et les vassaux de ceux-ci. Cliquez suivant pour continuer.;Wie Ihr auf der Militärseite sehen könnt, gibt es zwei Arten von Lehnstruppen, solche aus Eurer persönlichen Domäne und solche, die von euren Vasallen gestellt werden. Domänentruppen sind jene aus Provinzen, die von Euch kontrolliert werden während die Vasallentruppen aus Provinzen stammen, die von euren Vasallen oder den Vasallen Eurer Vasallen kontrolliert werden. Klickt weiter, um fortzufahren.;;En la pestaña militar puedes observar que hay dos tipos diferentes de levas: Las personales y las de los vasallos. Las levas personales son aquellas que controlas directamente, mientras que las de los vasallos son los que controlan tus vasallos y sus vasallos. Selecciona continuar para seguir.;;;;;;;;;x
tut_1a_3;Mivel katolikus uralkodóként játszol, ezért az egyházi személyek által birtokolt földek után csak akkor fogsz jövedelmet kapni, ha a püspök véleménye rólad kedvezõbb, mint a pápáról alkotott véleménye. Máskülönben neki adóznak. A püspökön kívüli hûbéreseidtõl mindig fogsz adót kapni, de többet kaphatsz, ha kedvelnek.;Parce que vous jouez un seigneur catholique, les provinces contrôlées par les titulaires religieux tels que les évêques ne vous fourniront de l'argent que si leur opinion de vous est plus haute que celle qu'ils ont du Pape. Sinon l'argent ira à celui-ci. Les vassaux qui ne sont pas des évêques vous donnerons toujours de l'argent mais vous en recevrez plus s'ils vous apprécient.;Da Ihr einen katholischen Herrscher spielt zahlen Euch religiöse Vasallen wie Bischöfe nur dann Steuern, wenn sie eine höhere Meinung von Euch als vom amtierenden Papst haben. Andernfalls zahlen sie an die Kirche. Andere Arten von Vasallen als Bischöfe zahlen stets an Euch, jedoch erhaltet ihr mehr Geld, wenn sie Euch mögen. ;;Como estas jugando con un gobernante católico, las provincias gobernadas por gobernantes eclesiásticos, como los obispos, sólo te pagarán impuestos si su opinión sobre ti es mayor que su opinión sobre el Papa. Si no todo el dinero ira para él. Todos los demás vasallos te pagaran los impuestos, más cuanto mejor opinión tengan de ti.;;;;;;;;;x
FAMILY_DUES_IRO;Felnõtt §Y$DYNASTY$§!-házi férfiak az udvarban: §Y$NUM$§! (§Y$GOLD$§!¤ fejenként).;Hommes adultes §Y$DYNASTY$§! à la cour: §Y$NUM$§! (§Y$GOLD$§!¤ chacun).;Erwachsene §Y$DYNASTY$§!-Männer am Hof: §Y$NUM$§! (je §Y$GOLD$§!¤).;;Hombres adultos de la casa §Y$DYNASTY$§! en tu corte: §Y$NUM$§! (§Y$GOLD$§!¤ cada).;;;;;;;;;x
FAMILY_DUES_DRO;Felnõtt férfi udvaroncok egy patrícius családban megkövetelik a bevétel megosztását. Viszont megnövelik a kereskedelmi állomás limitet.;Les courtiers mâles adultes de la dynastie du Patricien demandent tous une partie des revenus. En échange, ils augmentent la limite des Comptoirs.;Erwachsene männliche Höflinge der Dynastie des Patriziers erhalten einen Anteil an den Einkünften, erhöhen dafür aber auch die Obergrenze an möglichen Handelsposten.;;Los cortesanos varones adultos de la dinastía del Patricio recibirán una parte de los ingresos. Como contraprestación incrementarán el límite de puestos comerciales que puedes tener.;;;;;;;;;x
coastal_republic_desc;§Y$CLAIMANT$§! hadat üzenhet §Y$TITLE$§! parti területének a birtoklásáért, mivel vagy neki, vagy egy hûbéres patríciusnak kereskedelmi állomása van a területen, vagy a célpont egy rivális kereskedõ köztársaság.;§Y$CLAIMANT$§! peuvent déclarer la guerre pour prendre possession de §Y$TITLE$§! côtière puisqu'il (ou un Patricien vassal) y a un comptoir ou que la cible est une république marchande rivale.;§Y$CLAIMANT$§! kann Krieg erklären, um die Kontrolle über die Küste von §Y$TITLE$§! zu erlangen, da entweder er oder ein Patriziervasall dort einen Handelsposten besitzt oder das Ziel einer rivalisierenden Handelsrepublik gehört.;;§Y$CLAIMANT$§! puede declarar la guerra para tomar el costero §Y$TITLE$§! porque él o un patricio vasallo tiene un puesto comercial en el, o el objetivo forma parte de una republica mercantil rival.;;;;;;;;;x
coastal_county_republic_desc;Mint kereskedõ köztársaság, §Y$CLAIMANT$§! Hadat üzenhet §Y$TITLE$§! területének birtoklásáért, mivel már egy várost birtokol ott és a grófság a hatókörébe esik.;En tant que République Marchande, §Y$CLAIMANT$§! peuvent déclarer la guerre pour prendre le contrôle de §Y$TITLE$§! puisqu'ils y contrôlent déjà une ville et que le comté est à distance de celle-ci.;Als Handelsrepublik kann §Y$CLAIMANT$§! Krieg erklären, um die Kontrolle über §Y$TITLE$§! zu erlangen, da sie dort bereits eine Stadt kontrollieren und die Provinz in Reichweite ist.;;§Y$CLAIMANT$§! puede declarar la guerra para controlar §Y$TITLE$§! porque ya contola su ciudad y el condado está en nuestra esfera de influencia.;;;;;;;;;x
MAX_TRADE_POSTS;Kereskedelmi állomás limit: §Y$LIMIT$§!;Limite de Comptoirs: §Y$LIMIT$§!;Obergrenze an Handelsposten;;Límite de puestos comerciales: §Y$LIMIT$§!;;;;;;;;;x
MIN_TRADE_POSTS;Minimális kereskedelmi állomás limit: §Y$NUM$§!;Limite de comptoirs minimum: §Y$NUM$§!;Mindestmenge an Handelsposten;;Límite mínimo de puestos comerciales: §Y$NUM$§!;;;;;;;;;x
ADULT_FAMILY_IN_COURT;Felnõtt férfi családtagok az udvarban: §Y+$VALUE$§!;Nombres de membres adultes mâles de la famille qui se trouvent à la cour: §Y+$VALUE$§!;Erwachsene männliche Familienmitglieder am Hofe: §Y+$VALUE$§!;;Familiares varones adultos en la corte: §Y+$VALUE$§!;;;;;;;;;x
IS_NOT_OVER_TRADEPOST_LIMIT;Nincsen a kereskedelmi állomás limit felett;Ne dépasse pas la limite de Comptoirs;Ist nicht über der Obergrenze an Handelsposten;;No estás por encima del límite de puestos comerciales;;;;;;;;;x
DECLARE_WAR_INTERACTION_0;A tûzszünet megszegése (ami véget ér §Y$DATE$§! napsján) §R$PRESTIGE$§! tekitély veszteséget okoz neked és csökkenti a §Y[Recipient.Religion.GetGroupName]§! vallású uralkodók véleményét rólad §R$OPINION$§! értékkel. Téged ezentúl '§YEsküszegõ§!' néven fognak emlegetni(§R-5§! diplomácia §Y5§! éven át.);Briser la trève (celle-ci termine le §Y$DATE$§!) vous coûterait §R$PRESTIGE$§! Prestige et dimunuerait de §R$OPINION$§! l'opinion qu'a de vous tous les dirigeants §Y[Recipient.Religion.GetGroupName]§! . Vous serez considéré un '§YBriseur de Trèves§!' (§R-5§!Diplomacie pour §Y5§! ans.);"Ein Bruch des Waffenstillstands (der §Y$DATE$§! endet) würde Euch §R$PRESTIGE$§! Prestige kosten und die Meinung aller Herrscher vom §Y[Recipient.Religion.GetGroupName]§!-Glauben von Euch um §R$OPINION$§! verschlechtern. Ihr würdet außerdem als ""§YEidbrecher§!"" angesehen werden (§R-5§! Diplomatie für §Y5§! Jahre)";;Romper la tregua (dura hasta §Y$DATE$§!) te costará §R$PRESTIGE$§! prestigio y reducirá la opinión de todos los gobernantes §Y[Recipient.Religion.GetGroupName]§! hacía ti. Además serás considerado un '§YViolador de Treguas§! (§R-5§! diplomacia durante §Y5§! años.);;;;;;;;;x
IMPRISON_INTERACTION_1B;Ennek a lehetõségnek a használta zsarnokinak minõsül, és rontani fogja a te köztársaságodon belüli véleményt rólad §R$OPINION$§ értékkel!;Utiliser cette option est considéré comme étant tyrannique et diminuera de §R$OPINION$§!;Dies wird als tyrannisch angesehen werden und die Meinung aller Personen in der Republik über Euch um §R$OPINION$§ verschlechtern!;;Llevar a cabo esta acción será considerada tiránica, y reducirá la opinión sobre ti de todos los personajes en la República en §R$OPINION$§!;;;;;;;;;x
OFFER_MARRIGE_INTERACTION_2A;Felajánlod, hogy §Y[ActorExtra.GetTitledFirstName]§W és §Y[RecipientExtra.GetTitledFirstName]§W egybekeljen. Mint a $MYPARTYTIER$ hozzátartozója, §Y$MYPARTY$§W számára $PRESTIGE$ tekintélyt jelentene beházasodni az §Y[RecipientExtra.GetOnlyDynastyName]-házba§W és $PRESTIGE2$ tekintélyt, hogy $THEIRPARTYTIER$ hozzátartozójával egybekel.;Proposez que §Y[ActorExtra.GetTitledFirstName]§W et §Y[RecipientExtra.GetTitledFirstName]§W se marrient. En tant que proche parent d'un $MYPARTYTIER$, §Y$MYPARTY$§W gagnerait $PRESTIGE$ prestige en se marriant avec quelqu'un de la maison §YHouse [RecipientExtra.GetOnlyDynastyName]§W et $PRESTIGE2$ pour avoir épousé un proche parent d'un $THEIRPARTYTIER$.;Die Heirat von §Y[ActorExtra.GetTitledFirstName]§W und §Y[RecipientExtra.GetTitledFirstName]§W vorschlagen. Als ein Verwandter von einem $MYPARTYTIER$ würde §Y$MYPARTY$§W $PRESTIGE$ Prestige dafür erhalten in das §YHaus [RecipientExtra.GetOnlyDynastyName]§W einzuheiraten und $PRESTIGE2$ Prestige für die Heirat mit einem Verwandten von einem $THEIRPARTYTIER$.;;Propón que §Y[ActorExtra.GetTitledFirstName]§W y §Y[RecipienteExtra.GetTitledFirstName]§W se casen. Como familiar de un $MYPARTYTIER$, §Y$MYPARTY$§! ganará $PRESTIGE$ prestigio por casarse con la §YCasa [RecipientExtra.GetOnlyDynastyName]§W y $PRESTIGE2$ por casarse con un familiar de un $THEIRPARTYTIER$.;;;;;;;;;x
OFFER_MARRIGE_INTERACTION_2B;Felajánlod, hogy §Y[ActorExtra.GetTitledFirstName]§W és §Y[RecipientExtra.GetTitledFirstName]§W egybekeljen. Mint a $MYPARTYTIER$ hozzátartozója, §Y$MYPARTY$§W és a te számodra $PRESTIGE$ tekintélyt jelentene beházasodni az §Y[RecipientExtra.GetOnlyDynastyName]-házba§W és $PRESTIGE2$ tekintélyt hogy egy $THEIRPARTYTIER$ hozzátartozóját veszi el.;Proposez que §Y[ActorExtra.GetTitledFirstName]§W et §Y[RecipientExtra.GetTitledFirstName]§W se marrient. En tant que proche parent d'un $MYPARTYTIER$, §Y$MYPARTY$§W et vous gagneriez $PRESTIGE$ prestige en se marriant avec quelqu'un de la maison §YHouse [RecipientExtra.GetOnlyDynastyName]§W et $PRESTIGE2$ pour avoir épousé un proche parent d'un $THEIRPARTYTIER$.;Die Heirat von §Y[ActorExtra.GetTitledFirstName]§W und §Y[RecipientExtra.GetTitledFirstName]§W vorschlagen. Als ein Verwandter von einem $MYPARTYTIER$ würden §Y$MYPARTY$§W und Ihr je $PRESTIGE$ Prestige dafür erhalten in das §YHaus [RecipientExtra.GetOnlyDynastyName]§W einzuheiraten und $PRESTIGE2$ Prestige für die Heirat mit einem Verwandten von einem $THEIRPARTYTIER$.;;Propón que §Y[ActorExtra.GetTitledFirstName]§W y §Y[RecipientExtra.GetTitledFirstName]§W se casen. Como familiar de un $MYPARTYTIER$, §Y$MYPARTY$§W y tú ganaréis $PRESTIGE$ prestigio por casarse con la §YCasa [RecipientExtra.GetOnlyDynastyName]§W y $PRESTIGE2$ por casarse con un familiar de un $THEIRPARTYTIER$.;;;;;;;;;x
